{"$schema":"https://json-schema.org/draft/2020-12/schema","$id":"https://unboundedaxiom.org/spec/opensound/0.1/analysis-attempt.schema.json","title":"Open Sound Analysis Attempt v0.1","type":"object","required":["object_type","schema_version","analysis_id","method_id","method_version","status","outputs","provenance"],"properties":{"object_type":{"const":"analysis_attempt"},"schema_version":{"const":"opensound-analysis-0.1"},"analysis_id":{"type":"string","minLength":1},"method_id":{"type":"string","minLength":1},"method_version":{"type":"string","minLength":1},"status":{"enum":["queued","running","completed","partial","abstained","not_applicable","failed","cancelled","superseded"]},"outputs":{"type":"object"},"provenance":{"type":"object"}},"additionalProperties":true}
